{
  "$schema": "../../schemas/anime.schema.json",
  "schemaVersion": 1,
  "id": "bili-28339735",
  "title": "孤独摇滚！",
  "rating": 9.4,
  "review": "演出把社恐的内心噪声变成了一整套可视化语言，同时又没有让角色只剩标签。乐队成长线和喜剧节奏都收得很稳。",
  "coverUrl": "https://s4.anilist.co/file/anilistcdn/media/anime/cover/large/bx130003-HTDmeL4RGeJ4.png",
  "note": "示例记录。封面来自 AniList，如果链接失效可以在不改动其他字段的情况下直接替换 `coverUrl`。",
  "externalIds": {
    "bangumi": "328609",
    "bilibiliMedia": "28339735",
    "anilist": "130003",
    "mal": "47917"
  },
  "match": {
    "status": "matched",
    "method": "site-id",
    "source": "bangumi-data",
    "confidence": 1,
    "matchedTitle": "ぼっち・ざ・ろっく！",
    "matchedAt": "2026-10-20T11:40:00Z"
  },
  "createdAt": "2026-10-20T11:40:00Z",
  "updatedAt": "2026-10-23T17:12:00Z"
}
