{
  "$schema": "../../schemas/anime.schema.json",
  "schemaVersion": 1,
  "id": "bili-21087073",
  "title": "葬送的芙莉莲",
  "rating": 9.6,
  "review": "它把漫长寿命变成了一种叙事尺度：那些当时没有说出口的话，会在几十年后重新获得意义。战斗克制，人物却始终饱满。",
  "coverUrl": "https://s4.anilist.co/file/anilistcdn/media/anime/cover/large/bx154587-qQTzQnEJJ3oB.jpg",
  "note": "示例记录。适合用来验证中文标题、日文原名与跨站 ID 的索引方式。",
  "externalIds": {
    "bangumi": "400602",
    "bilibiliMedia": "21087073",
    "anilist": "154587",
    "mal": "52991"
  },
  "match": {
    "status": "matched",
    "method": "site-id",
    "source": "bangumi-data",
    "confidence": 1,
    "matchedTitle": "葬送のフリーレン",
    "matchedAt": "2026-10-25T08:34:00Z"
  },
  "createdAt": "2026-10-24T09:10:00Z",
  "updatedAt": "2026-10-25T08:34:00Z"
}
