{
  "$schema": "../../schemas/anime.schema.json",
  "schemaVersion": 1,
  "id": "bili-292073015",
  "title": "相反的你和我",
  "rating": 9.2,
  "review": "人物关系写得轻巧，但每一次靠近都有清晰的动机。节奏不靠强冲突推进，反而让日常里的犹豫和坦白更有重量。",
  "coverUrl": "https://s4.anilist.co/file/anilistcdn/media/anime/cover/large/bx184951-s8Lg2muPBhdX.jpg",
  "note": "示例记录。Bilibili `media_id` 已与 bangumi-data、Bangumi 和 AniList 映射。",
  "externalIds": {
    "bangumi": "525565",
    "bilibiliMedia": "292073015",
    "anilist": "184951",
    "mal": "60371"
  },
  "match": {
    "status": "matched",
    "method": "site-id",
    "source": "bangumi-data",
    "confidence": 1,
    "matchedTitle": "正反対な君と僕",
    "matchedAt": "2026-10-25T08:30:00Z"
  },
  "createdAt": "2026-10-25T08:30:00Z",
  "updatedAt": "2026-10-25T08:30:00Z"
}
