{
  "$schema": "../../schemas/anime.schema.json",
  "schemaVersion": 1,
  "id": "bili-21174614",
  "title": "迷宫饭",
  "rating": 9.1,
  "review": "把迷宫探索写成了一套完整的生态观察。料理不是装饰，而是理解世界和人物的方法，最后几集对欲望与共存的讨论尤其漂亮。",
  "coverUrl": "https://s4.anilist.co/file/anilistcdn/media/anime/cover/large/bx153518-IVXPDY5ph3kO.jpg",
  "note": "示例记录。可以在 `review` 中使用 Markdown，但原始 HTML 会在构建时被禁用。",
  "externalIds": {
    "bangumi": "395378",
    "bilibiliMedia": "21174614",
    "anilist": "153518",
    "mal": "52701"
  },
  "match": {
    "status": "matched",
    "method": "site-id",
    "source": "bangumi-data",
    "confidence": 1,
    "matchedTitle": "ダンジョン飯",
    "matchedAt": "2026-10-21T10:15:00Z"
  },
  "createdAt": "2026-10-21T10:15:00Z",
  "updatedAt": "2026-10-25T07:05:00Z"
}
